{
  "$schema": "./deprecation-registry.schema.json",
  "version": "1.0.0",
  "lastUpdated": "2025-12-19",
  "description": "Central registry of deprecated commands, skills, agents, and patterns. Used by audit-references and fix-references skills to detect and remediate outdated references.",

  "commands": {
    "/write-agent": {
      "replacedBy": "/agent-manager",
      "deprecatedDate": "2024-11-01",
      "reason": "Consolidated into unified agent-manager command",
      "migrationNotes": "Use /agent-manager new, /agent-manager update, etc."
    },
    "/audit-agent": {
      "replacedBy": "/agent-manager audit",
      "deprecatedDate": "2024-11-01",
      "reason": "Consolidated into unified agent-manager command"
    },
    "/fix-agent": {
      "replacedBy": "/agent-manager fix",
      "deprecatedDate": "2024-11-01",
      "reason": "Consolidated into unified agent-manager command"
    }
  },

  "skills": {
    "claude-write-command": {
      "replacedBy": "claude-command-write",
      "deprecatedDate": "2024-11-28",
      "reason": "Naming convention: verb-last pattern (noun-verb)",
      "migrationNotes": "All claude-* skills follow pattern: claude-{noun}-{verb}"
    },
    "claude-agent-audit-skills": {
      "replacedBy": null,
      "deprecatedDate": "2024-11-27",
      "reason": "Functionality merged into claude-agent-audit orchestrator",
      "status": "removed"
    },
    "claude-agent-audit-report": {
      "replacedBy": "claude-agent-audit",
      "deprecatedDate": "2024-11-27",
      "reason": "Renamed to match orchestrator pattern"
    },
    "zustand-state-management": {
      "replacedBy": "frontend-zustand-state-management",
      "deprecatedDate": "2024-11-28",
      "reason": "Naming convention: frontend-* prefix for frontend-specific skills",
      "migrationNotes": "All frontend framework skills follow pattern: frontend-{framework}-{feature}"
    },
    "mcp-code-create": {
      "replacedBy": "mcp-code-write",
      "deprecatedDate": "2025-11-29",
      "reason": "Consolidated with mcp-code-2-skill into unified mcp-code-write skill (78.4% token reduction)",
      "migrationNotes": "Use mcp-code-write Mode 1 for creating wrappers. See MIGRATION.md for detailed guide."
    },
    "mcp-code-2-skill": {
      "replacedBy": "mcp-code-write",
      "deprecatedDate": "2025-11-29",
      "reason": "Consolidated with mcp-code-create into unified mcp-code-write skill (78.4% token reduction)",
      "migrationNotes": "Use mcp-code-write Mode 3 for generating service-specific skills. See MIGRATION.md for detailed guide."
    },
    "claude-skill-audit": {
      "replacedBy": "claude-skill-compliance",
      "deprecatedDate": "2025-11-29",
      "reason": "Consolidated with claude-skill-fix into unified claude-skill-compliance skill",
      "migrationNotes": "Use claude-skill-compliance with audit mode for validation. Supports --phase filtering."
    },
    "claude-skill-audit-commands": {
      "replacedBy": "claude-skill-compliance",
      "deprecatedDate": "2025-11-29",
      "reason": "Phase-specific skill consolidated into claude-skill-compliance (Phase 11)",
      "migrationNotes": "Use: npm run -w @chariot/skill-compliance audit -- SKILL_PATH --phase 11"
    },
    "claude-skill-audit-frontmatter": {
      "replacedBy": "claude-skill-compliance",
      "deprecatedDate": "2025-11-29",
      "reason": "Phase-specific skill consolidated into claude-skill-compliance (Phase 1)",
      "migrationNotes": "Use: npm run -w @chariot/skill-compliance audit -- SKILL_PATH --phase 1"
    },
    "claude-skill-audit-links": {
      "replacedBy": "claude-skill-compliance",
      "deprecatedDate": "2025-11-29",
      "reason": "Phase-specific skill consolidated into claude-skill-compliance (Phase 4)",
      "migrationNotes": "Use: npm run -w @chariot/skill-compliance audit -- SKILL_PATH --phase 4"
    },
    "claude-skill-audit-references": {
      "replacedBy": "claude-skill-compliance",
      "deprecatedDate": "2025-11-29",
      "reason": "Phase-specific skill consolidated into claude-skill-compliance (Phase 10)",
      "migrationNotes": "Use: npm run -w @chariot/skill-compliance audit -- SKILL_PATH --phase 10"
    },
    "claude-skill-audit-report": {
      "replacedBy": "claude-skill-compliance",
      "deprecatedDate": "2025-11-29",
      "reason": "Reporting functionality integrated into claude-skill-compliance output",
      "migrationNotes": "Use claude-skill-compliance audit mode - returns pre-formatted markdown report"
    },
    "claude-skill-audit-script-paths": {
      "replacedBy": "claude-skill-compliance",
      "deprecatedDate": "2025-11-29",
      "reason": "Phase-specific skill consolidated into claude-skill-compliance (Phase 6)",
      "migrationNotes": "Use: npm run -w @chariot/skill-compliance audit -- SKILL_PATH --phase 6"
    },
    "claude-skill-audit-scripts": {
      "replacedBy": "claude-skill-compliance",
      "deprecatedDate": "2025-11-29",
      "reason": "Phase-specific skill consolidated into claude-skill-compliance (Phase 8)",
      "migrationNotes": "Use: npm run -w @chariot/skill-compliance audit -- SKILL_PATH --phase 8"
    },
    "claude-skill-audit-structure": {
      "replacedBy": "claude-skill-compliance",
      "deprecatedDate": "2025-11-29",
      "reason": "Phase-specific skill consolidated into claude-skill-compliance (Phase 5)",
      "migrationNotes": "Use: npm run -w @chariot/skill-compliance audit -- SKILL_PATH --phase 5"
    },
    "claude-skill-fix": {
      "replacedBy": "claude-skill-compliance",
      "deprecatedDate": "2025-11-29",
      "reason": "Consolidated with claude-skill-audit into unified claude-skill-compliance skill",
      "migrationNotes": "Use claude-skill-compliance with fix mode for auto-remediation. Supports --phase filtering and --dry-run."
    },
    "claude-skill-fix-cli-errors": {
      "replacedBy": "claude-skill-compliance",
      "deprecatedDate": "2025-11-29",
      "reason": "Phase-specific skill consolidated into claude-skill-compliance (Phase 12)",
      "migrationNotes": "Use: npm run -w @chariot/skill-compliance fix -- SKILL_PATH --phase 12"
    },
    "claude-skill-fix-commands": {
      "replacedBy": "claude-skill-compliance",
      "deprecatedDate": "2025-11-29",
      "reason": "Phase-specific skill consolidated into claude-skill-compliance (Phase 11)",
      "migrationNotes": "Use: npm run -w @chariot/skill-compliance fix -- SKILL_PATH --phase 11"
    },
    "claude-skill-fix-frontmatter": {
      "replacedBy": "claude-skill-compliance",
      "deprecatedDate": "2025-11-29",
      "reason": "Phase-specific skill consolidated into claude-skill-compliance (Phase 2)",
      "migrationNotes": "Use: npm run -w @chariot/skill-compliance fix -- SKILL_PATH --phase 2"
    },
    "claude-skill-fix-links": {
      "replacedBy": "claude-skill-compliance",
      "deprecatedDate": "2025-11-29",
      "reason": "Phase-specific skill consolidated into claude-skill-compliance (Phase 4)",
      "migrationNotes": "Use: npm run -w @chariot/skill-compliance fix -- SKILL_PATH --phase 4"
    },
    "claude-skill-fix-references": {
      "replacedBy": "claude-skill-compliance",
      "deprecatedDate": "2025-11-29",
      "reason": "Phase-specific skill consolidated into claude-skill-compliance (Phase 10)",
      "migrationNotes": "Use: npm run -w @chariot/skill-compliance fix -- SKILL_PATH --phase 10"
    },
    "claude-skill-fix-script-paths": {
      "replacedBy": "claude-skill-compliance",
      "deprecatedDate": "2025-11-29",
      "reason": "Phase-specific skill consolidated into claude-skill-compliance (Phase 6)",
      "migrationNotes": "Use: npm run -w @chariot/skill-compliance fix -- SKILL_PATH --phase 6"
    },
    "claude-skill-fix-scripts": {
      "replacedBy": "claude-skill-compliance",
      "deprecatedDate": "2025-11-29",
      "reason": "Phase-specific skill consolidated into claude-skill-compliance (Phase 7)",
      "migrationNotes": "Use: npm run -w @chariot/skill-compliance fix -- SKILL_PATH --phase 7"
    },
    "claude-skill-fix-structure": {
      "replacedBy": "claude-skill-compliance",
      "deprecatedDate": "2025-11-29",
      "reason": "Phase-specific skill consolidated into claude-skill-compliance (Phase 5)",
      "migrationNotes": "Use: npm run -w @chariot/skill-compliance fix -- SKILL_PATH --phase 5"
    },
    "claude-skill-fix-typescript-structure": {
      "replacedBy": "claude-skill-compliance",
      "deprecatedDate": "2025-11-29",
      "reason": "Phase-specific skill consolidated into claude-skill-compliance (Phase 8)",
      "migrationNotes": "Use: npm run -w @chariot/skill-compliance fix -- SKILL_PATH --phase 8"
    },
    "claude-skill-detect-opportunity": {
      "replacedBy": "claude-skill-write",
      "deprecatedDate": "2025-11-29",
      "reason": "Pattern detection functionality integrated into claude-skill-write workflow",
      "migrationNotes": "Use claude-skill-write to create skills based on detected patterns"
    },
    "claude-skill-rename": {
      "replacedBy": null,
      "deprecatedDate": "2025-11-29",
      "reason": "Skill renaming functionality integrated into /skill-manager rename command",
      "migrationNotes": "Use: /skill-manager rename OLD_NAME NEW_NAME",
      "status": "removed"
    },
    "claude-mcp-audit-references": {
      "replacedBy": "mcp-code-compliance",
      "deprecatedDate": "2025-11-29",
      "reason": "MCP reference audit consolidated into mcp-code-compliance (Phase 5)",
      "migrationNotes": "Use mcp-code-compliance audit mode with Phase 5 for reference validation"
    },
    "mcp-chrome-devtools-guide": {
      "replacedBy": "mcp-tools-chrome-devtools",
      "deprecatedDate": "2025-11-29",
      "reason": "Renamed to follow mcp-tools-{service} naming convention",
      "migrationNotes": "Use: skill 'mcp-tools-chrome-devtools'"
    },
    "mcp-code-chrome-devtools-guide": {
      "replacedBy": "mcp-tools-chrome-devtools",